{
  "format_version": 1,
  "boards": [
    {
      "id": "sv08-main",
      "label": "Sovol SV08 original mainboard reference",
      "role": "main",
      "revision": "unknown installed/drawing revision",
      "source": {
        "path": "upstream/sovol-sv08/home/sovol/printer_data/config/printer.cfg",
        "revision": "a60644875f8c756d20b3828c9416518b414b5491",
        "sha256": "8936ceabc98a6583f3cff17093905162ac516a0996c8714ef62825a6cb005289",
        "accessed": "2026-10-04",
        "drawing": {
          "path": "upstream/sovol-sv08/Motherboard/MCU_PIN_definition.pdf",
          "page": 1,
          "revision": "unknown drawing revision",
          "sha256": "8b1f418b4f264442274be6a45abfbcba5c09b7445a168294ca7d730f4a0d18fa"
        }
      },
      "evidence": "documented-reference",
      "warning": "Reference mapping only; installed identity and electrical ratings require confirmation.",
      "unknowns": [
        "MCU clock/offset",
        "installed match",
        "electrical ratings",
        "complete connector inventory"
      ],
      "signals": {
        "PE2": {
          "capabilities": [
            "step"
          ],
          "source": {
            "line": 161,
            "section": "stepper_x",
            "option": "step_pin",
            "reference_only": false
          },
          "reserved": false,
          "evidence": "documented-reference"
        },
        "PE0": {
          "capabilities": [
            "dir"
          ],
          "source": {
            "line": 162,
            "section": "stepper_x",
            "option": "dir_pin",
            "reference_only": false
          },
          "reserved": false,
          "evidence": "documented-reference"
        },
        "PE3": {
          "capabilities": [
            "enable"
          ],
          "source": {
            "line": 163,
            "section": "stepper_x",
            "option": "enable_pin",
            "reference_only": false
          },
          "reserved": false,
          "evidence": "documented-reference"
        },
        "PE1": {
          "capabilities": [
            "uart"
          ],
          "source": {
            "line": 176,
            "section": "tmc2209 stepper_x",
            "option": "uart_pin",
            "reference_only": false
          },
          "reserved": false,
          "evidence": "documented-reference"
        },
        "PE15": {
          "capabilities": [
            "input"
          ],
          "source": {
            "line": 184,
            "section": "tmc2209 stepper_x",
            "option": "diag_pin",
            "reference_only": false
          },
          "reserved": false,
          "evidence": "documented-reference"
        },
        "PB8": {
          "capabilities": [
            "step"
          ],
          "source": {
            "line": 187,
            "section": "stepper_y",
            "option": "step_pin",
            "reference_only": false
          },
          "reserved": false,
          "evidence": "documented-reference"
        },
        "PB6": {
          "capabilities": [
            "dir"
          ],
          "source": {
            "line": 188,
            "section": "stepper_y",
            "option": "dir_pin",
            "reference_only": false
          },
          "reserved": false,
          "evidence": "documented-reference"
        },
        "PB9": {
          "capabilities": [
            "enable"
          ],
          "source": {
            "line": 189,
            "section": "stepper_y",
            "option": "enable_pin",
            "reference_only": false
          },
          "reserved": false,
          "evidence": "documented-reference"
        },
        "PB7": {
          "capabilities": [
            "uart"
          ],
          "source": {
            "line": 202,
            "section": "tmc2209 stepper_y",
            "option": "uart_pin",
            "reference_only": false
          },
          "reserved": false,
          "evidence": "documented-reference"
        },
        "PE13": {
          "capabilities": [
            "input"
          ],
          "source": {
            "line": 210,
            "section": "tmc2209 stepper_y",
            "option": "diag_pin",
            "reference_only": false
          },
          "reserved": false,
          "evidence": "documented-reference"
        },
        "PC0": {
          "capabilities": [
            "step"
          ],
          "source": {
            "line": 213,
            "section": "stepper_z",
            "option": "step_pin",
            "reference_only": false
          },
          "reserved": false,
          "evidence": "documented-reference"
        },
        "PE5": {
          "capabilities": [
            "dir"
          ],
          "source": {
            "line": 214,
            "section": "stepper_z",
            "option": "dir_pin",
            "reference_only": false
          },
          "reserved": false,
          "evidence": "documented-reference"
        },
        "PC1": {
          "capabilities": [
            "enable"
          ],
          "source": {
            "line": 215,
            "section": "stepper_z",
            "option": "enable_pin",
            "reference_only": false
          },
          "reserved": false,
          "evidence": "documented-reference"
        },
        "PE6": {
          "capabilities": [
            "uart"
          ],
          "source": {
            "line": 229,
            "section": "tmc2209 stepper_z",
            "option": "uart_pin",
            "reference_only": false
          },
          "reserved": false,
          "evidence": "documented-reference"
        },
        "PD3": {
          "capabilities": [
            "step"
          ],
          "source": {
            "line": 238,
            "section": "stepper_z1",
            "option": "step_pin",
            "reference_only": false
          },
          "reserved": false,
          "evidence": "documented-reference"
        },
        "PD1": {
          "capabilities": [
            "dir"
          ],
          "source": {
            "line": 239,
            "section": "stepper_z1",
            "option": "dir_pin",
            "reference_only": false
          },
          "reserved": false,
          "evidence": "documented-reference"
        },
        "PD4": {
          "capabilities": [
            "enable"
          ],
          "source": {
            "line": 240,
            "section": "stepper_z1",
            "option": "enable_pin",
            "reference_only": false
          },
          "reserved": false,
          "evidence": "documented-reference"
        },
        "PD2": {
          "capabilities": [
            "uart"
          ],
          "source": {
            "line": 246,
            "section": "tmc2209 stepper_z1",
            "option": "uart_pin",
            "reference_only": false
          },
          "reserved": false,
          "evidence": "documented-reference"
        },
        "PD7": {
          "capabilities": [
            "step"
          ],
          "source": {
            "line": 255,
            "section": "stepper_z2",
            "option": "step_pin",
            "reference_only": false
          },
          "reserved": false,
          "evidence": "documented-reference"
        },
        "PD5": {
          "capabilities": [
            "dir"
          ],
          "source": {
            "line": 256,
            "section": "stepper_z2",
            "option": "dir_pin",
            "reference_only": false
          },
          "reserved": false,
          "evidence": "documented-reference"
        },
        "PB5": {
          "capabilities": [
            "enable"
          ],
          "source": {
            "line": 257,
            "section": "stepper_z2",
            "option": "enable_pin",
            "reference_only": false
          },
          "reserved": false,
          "evidence": "documented-reference"
        },
        "PD6": {
          "capabilities": [
            "uart"
          ],
          "source": {
            "line": 263,
            "section": "tmc2209 stepper_z2",
            "option": "uart_pin",
            "reference_only": false
          },
          "reserved": false,
          "evidence": "documented-reference"
        },
        "PD11": {
          "capabilities": [
            "step"
          ],
          "source": {
            "line": 272,
            "section": "stepper_z3",
            "option": "step_pin",
            "reference_only": false
          },
          "reserved": false,
          "evidence": "documented-reference"
        },
        "PD9": {
          "capabilities": [
            "dir"
          ],
          "source": {
            "line": 273,
            "section": "stepper_z3",
            "option": "dir_pin",
            "reference_only": false
          },
          "reserved": false,
          "evidence": "documented-reference"
        },
        "PD12": {
          "capabilities": [
            "enable"
          ],
          "source": {
            "line": 274,
            "section": "stepper_z3",
            "option": "enable_pin",
            "reference_only": false
          },
          "reserved": false,
          "evidence": "documented-reference"
        },
        "PD10": {
          "capabilities": [
            "uart"
          ],
          "source": {
            "line": 280,
            "section": "tmc2209 stepper_z3",
            "option": "uart_pin",
            "reference_only": false
          },
          "reserved": false,
          "evidence": "documented-reference"
        },
        "PE9": {
          "capabilities": [
            "input"
          ],
          "source": {
            "line": 339,
            "section": "filament_switch_sensor filament_sensor",
            "option": "switch_pin",
            "reference_only": false
          },